{
  "id": "team_spread_eng",
  "team_code": "ENG",
  "team_name": "England",
  "layout": "team_spread_4x5",
  "slots": [
    {
      "index": 0,
      "sticker_code": "ENG1",
      "x": 0.06,
      "y": 0.08,
      "w": 0.20500000000000002,
      "h": 0.152
    },
    {
      "index": 1,
      "sticker_code": "ENG2",
      "x": 0.28500000000000003,
      "y": 0.08,
      "w": 0.20500000000000002,
      "h": 0.152
    },
    {
      "index": 2,
      "sticker_code": "ENG3",
      "x": 0.51,
      "y": 0.08,
      "w": 0.20500000000000002,
      "h": 0.152
    },
    {
      "index": 3,
      "sticker_code": "ENG4",
      "x": 0.7350000000000001,
      "y": 0.08,
      "w": 0.20500000000000002,
      "h": 0.152
    },
    {
      "index": 4,
      "sticker_code": "ENG5",
      "x": 0.06,
      "y": 0.252,
      "w": 0.20500000000000002,
      "h": 0.152
    },
    {
      "index": 5,
      "sticker_code": "ENG6",
      "x": 0.28500000000000003,
      "y": 0.252,
      "w": 0.20500000000000002,
      "h": 0.152
    },
    {
      "index": 6,
      "sticker_code": "ENG7",
      "x": 0.51,
      "y": 0.252,
      "w": 0.20500000000000002,
      "h": 0.152
    },
    {
      "index": 7,
      "sticker_code": "ENG8",
      "x": 0.7350000000000001,
      "y": 0.252,
      "w": 0.20500000000000002,
      "h": 0.152
    },
    {
      "index": 8,
      "sticker_code": "ENG9",
      "x": 0.06,
      "y": 0.424,
      "w": 0.20500000000000002,
      "h": 0.152
    },
    {
      "index": 9,
      "sticker_code": "ENG10",
      "x": 0.28500000000000003,
      "y": 0.424,
      "w": 0.20500000000000002,
      "h": 0.152
    },
    {
      "index": 10,
      "sticker_code": "ENG11",
      "x": 0.51,
      "y": 0.424,
      "w": 0.20500000000000002,
      "h": 0.152
    },
    {
      "index": 11,
      "sticker_code": "ENG12",
      "x": 0.7350000000000001,
      "y": 0.424,
      "w": 0.20500000000000002,
      "h": 0.152
    },
    {
      "index": 12,
      "sticker_code": "ENG13",
      "x": 0.06,
      "y": 0.596,
      "w": 0.20500000000000002,
      "h": 0.152
    },
    {
      "index": 13,
      "sticker_code": "ENG14",
      "x": 0.28500000000000003,
      "y": 0.596,
      "w": 0.20500000000000002,
      "h": 0.152
    },
    {
      "index": 14,
      "sticker_code": "ENG15",
      "x": 0.51,
      "y": 0.596,
      "w": 0.20500000000000002,
      "h": 0.152
    },
    {
      "index": 15,
      "sticker_code": "ENG16",
      "x": 0.7350000000000001,
      "y": 0.596,
      "w": 0.20500000000000002,
      "h": 0.152
    },
    {
      "index": 16,
      "sticker_code": "ENG17",
      "x": 0.06,
      "y": 0.7679999999999999,
      "w": 0.20500000000000002,
      "h": 0.152
    },
    {
      "index": 17,
      "sticker_code": "ENG18",
      "x": 0.28500000000000003,
      "y": 0.7679999999999999,
      "w": 0.20500000000000002,
      "h": 0.152
    },
    {
      "index": 18,
      "sticker_code": "ENG19",
      "x": 0.51,
      "y": 0.7679999999999999,
      "w": 0.20500000000000002,
      "h": 0.152
    },
    {
      "index": 19,
      "sticker_code": "ENG20",
      "x": 0.7350000000000001,
      "y": 0.7679999999999999,
      "w": 0.20500000000000002,
      "h": 0.152
    }
  ]
}