{
  "id": "team_spread_nzl",
  "team_code": "NZL",
  "team_name": "New Zealand",
  "layout": "team_spread_4x5",
  "slots": [
    {
      "index": 0,
      "sticker_code": "NZL1",
      "x": 0.06,
      "y": 0.08,
      "w": 0.20500000000000002,
      "h": 0.152
    },
    {
      "index": 1,
      "sticker_code": "NZL2",
      "x": 0.28500000000000003,
      "y": 0.08,
      "w": 0.20500000000000002,
      "h": 0.152
    },
    {
      "index": 2,
      "sticker_code": "NZL3",
      "x": 0.51,
      "y": 0.08,
      "w": 0.20500000000000002,
      "h": 0.152
    },
    {
      "index": 3,
      "sticker_code": "NZL4",
      "x": 0.7350000000000001,
      "y": 0.08,
      "w": 0.20500000000000002,
      "h": 0.152
    },
    {
      "index": 4,
      "sticker_code": "NZL5",
      "x": 0.06,
      "y": 0.252,
      "w": 0.20500000000000002,
      "h": 0.152
    },
    {
      "index": 5,
      "sticker_code": "NZL6",
      "x": 0.28500000000000003,
      "y": 0.252,
      "w": 0.20500000000000002,
      "h": 0.152
    },
    {
      "index": 6,
      "sticker_code": "NZL7",
      "x": 0.51,
      "y": 0.252,
      "w": 0.20500000000000002,
      "h": 0.152
    },
    {
      "index": 7,
      "sticker_code": "NZL8",
      "x": 0.7350000000000001,
      "y": 0.252,
      "w": 0.20500000000000002,
      "h": 0.152
    },
    {
      "index": 8,
      "sticker_code": "NZL9",
      "x": 0.06,
      "y": 0.424,
      "w": 0.20500000000000002,
      "h": 0.152
    },
    {
      "index": 9,
      "sticker_code": "NZL10",
      "x": 0.28500000000000003,
      "y": 0.424,
      "w": 0.20500000000000002,
      "h": 0.152
    },
    {
      "index": 10,
      "sticker_code": "NZL11",
      "x": 0.51,
      "y": 0.424,
      "w": 0.20500000000000002,
      "h": 0.152
    },
    {
      "index": 11,
      "sticker_code": "NZL12",
      "x": 0.7350000000000001,
      "y": 0.424,
      "w": 0.20500000000000002,
      "h": 0.152
    },
    {
      "index": 12,
      "sticker_code": "NZL13",
      "x": 0.06,
      "y": 0.596,
      "w": 0.20500000000000002,
      "h": 0.152
    },
    {
      "index": 13,
      "sticker_code": "NZL14",
      "x": 0.28500000000000003,
      "y": 0.596,
      "w": 0.20500000000000002,
      "h": 0.152
    },
    {
      "index": 14,
      "sticker_code": "NZL15",
      "x": 0.51,
      "y": 0.596,
      "w": 0.20500000000000002,
      "h": 0.152
    },
    {
      "index": 15,
      "sticker_code": "NZL16",
      "x": 0.7350000000000001,
      "y": 0.596,
      "w": 0.20500000000000002,
      "h": 0.152
    },
    {
      "index": 16,
      "sticker_code": "NZL17",
      "x": 0.06,
      "y": 0.7679999999999999,
      "w": 0.20500000000000002,
      "h": 0.152
    },
    {
      "index": 17,
      "sticker_code": "NZL18",
      "x": 0.28500000000000003,
      "y": 0.7679999999999999,
      "w": 0.20500000000000002,
      "h": 0.152
    },
    {
      "index": 18,
      "sticker_code": "NZL19",
      "x": 0.51,
      "y": 0.7679999999999999,
      "w": 0.20500000000000002,
      "h": 0.152
    },
    {
      "index": 19,
      "sticker_code": "NZL20",
      "x": 0.7350000000000001,
      "y": 0.7679999999999999,
      "w": 0.20500000000000002,
      "h": 0.152
    }
  ]
}