{
  "id": "team_spread_uzb",
  "team_code": "UZB",
  "team_name": "Uzbekistan",
  "layout": "team_spread_4x5",
  "slots": [
    {
      "index": 0,
      "sticker_code": "UZB1",
      "x": 0.06,
      "y": 0.08,
      "w": 0.20500000000000002,
      "h": 0.152
    },
    {
      "index": 1,
      "sticker_code": "UZB2",
      "x": 0.28500000000000003,
      "y": 0.08,
      "w": 0.20500000000000002,
      "h": 0.152
    },
    {
      "index": 2,
      "sticker_code": "UZB3",
      "x": 0.51,
      "y": 0.08,
      "w": 0.20500000000000002,
      "h": 0.152
    },
    {
      "index": 3,
      "sticker_code": "UZB4",
      "x": 0.7350000000000001,
      "y": 0.08,
      "w": 0.20500000000000002,
      "h": 0.152
    },
    {
      "index": 4,
      "sticker_code": "UZB5",
      "x": 0.06,
      "y": 0.252,
      "w": 0.20500000000000002,
      "h": 0.152
    },
    {
      "index": 5,
      "sticker_code": "UZB6",
      "x": 0.28500000000000003,
      "y": 0.252,
      "w": 0.20500000000000002,
      "h": 0.152
    },
    {
      "index": 6,
      "sticker_code": "UZB7",
      "x": 0.51,
      "y": 0.252,
      "w": 0.20500000000000002,
      "h": 0.152
    },
    {
      "index": 7,
      "sticker_code": "UZB8",
      "x": 0.7350000000000001,
      "y": 0.252,
      "w": 0.20500000000000002,
      "h": 0.152
    },
    {
      "index": 8,
      "sticker_code": "UZB9",
      "x": 0.06,
      "y": 0.424,
      "w": 0.20500000000000002,
      "h": 0.152
    },
    {
      "index": 9,
      "sticker_code": "UZB10",
      "x": 0.28500000000000003,
      "y": 0.424,
      "w": 0.20500000000000002,
      "h": 0.152
    },
    {
      "index": 10,
      "sticker_code": "UZB11",
      "x": 0.51,
      "y": 0.424,
      "w": 0.20500000000000002,
      "h": 0.152
    },
    {
      "index": 11,
      "sticker_code": "UZB12",
      "x": 0.7350000000000001,
      "y": 0.424,
      "w": 0.20500000000000002,
      "h": 0.152
    },
    {
      "index": 12,
      "sticker_code": "UZB13",
      "x": 0.06,
      "y": 0.596,
      "w": 0.20500000000000002,
      "h": 0.152
    },
    {
      "index": 13,
      "sticker_code": "UZB14",
      "x": 0.28500000000000003,
      "y": 0.596,
      "w": 0.20500000000000002,
      "h": 0.152
    },
    {
      "index": 14,
      "sticker_code": "UZB15",
      "x": 0.51,
      "y": 0.596,
      "w": 0.20500000000000002,
      "h": 0.152
    },
    {
      "index": 15,
      "sticker_code": "UZB16",
      "x": 0.7350000000000001,
      "y": 0.596,
      "w": 0.20500000000000002,
      "h": 0.152
    },
    {
      "index": 16,
      "sticker_code": "UZB17",
      "x": 0.06,
      "y": 0.7679999999999999,
      "w": 0.20500000000000002,
      "h": 0.152
    },
    {
      "index": 17,
      "sticker_code": "UZB18",
      "x": 0.28500000000000003,
      "y": 0.7679999999999999,
      "w": 0.20500000000000002,
      "h": 0.152
    },
    {
      "index": 18,
      "sticker_code": "UZB19",
      "x": 0.51,
      "y": 0.7679999999999999,
      "w": 0.20500000000000002,
      "h": 0.152
    },
    {
      "index": 19,
      "sticker_code": "UZB20",
      "x": 0.7350000000000001,
      "y": 0.7679999999999999,
      "w": 0.20500000000000002,
      "h": 0.152
    }
  ]
}